program_id,age,average_rating,backdrop_path,broadcasting_day,broadcasting_episode,broadcasting_station,end_flag,poster_img,rating_cnt,summary,title,first_air_date,bookmark_cnt
64812,,7.469,https://image.tmdb.org/t/p/original/2ra4GrxL0BUapsA5gy6XJfXcecU.jpg,,,KBS2,b'\x00',https://image.tmdb.org/t/p/original/mcd9QLl07DxjihIZT21dsCAETyk.jpg,,각기 다른 이유로 이곳에 모인 다양한 국적의 교사와 학생들이 '무림학교'의 특별한 인생 교육을 통해 부딪치고 소통하며 진정한 의협을 배워갈 글로벌 청춘 캠퍼스 드라마,무림학교,2016-01-10 15:00:00,
64826,,7.2,https://image.tmdb.org/t/p/original/x4aOlHVSV8tUNLbFYEpzmkn9PYU.jpg,,,JTBC,b'\x00',https://image.tmdb.org/t/p/original/gq8j27c1UfKlN2VfbX9oHJZyvJM.jpg,,운명이 뒤바뀐 두 여자와 모든 것을 다 가진 한 남자가 진정성을 찾아가는 과정을 그리는 작품,그녀의 신화,2013-08-04 15:00:00,
64840,,8.2,https://image.tmdb.org/t/p/original/bxjcFJJrNkWZvE4FPqBhYG8vecU.jpg,,,tvN,b'\x00',https://image.tmdb.org/t/p/original/mB6FlHFK0A4DPyuGTrlM4QgEkIH.jpg,,"간절함이 보내온 신호 ""우리의 시간은 이어져있다."" 현재의 형사들과 과거의 형사가 낡은 무전기로 교감을 나누며 장기 미제사건을 다시 파헤친다. 본의 아니게 연예인 스토킹 혐의로 경찰조사를 받게 된 해영은, 그날 밤 경찰서 한 구석에서 낡은 무전기 하나를 발견한다. 무전기를 통해 해영에게 말을 건네는 ‘이재한’이라는 이름의 형사. 놀랍게도 그 사람은 15년 동안 미제로 남아있던 김윤정 유괴사건에 대한 단서를 가르쳐주는데...",시그널,2016-01-21 15:00:00,
65143,,8.47,https://image.tmdb.org/t/p/original/o9Z8O0gdi6Qvvzk86RdnnBjBGDq.jpg,,,KBS2,b'\x00',https://image.tmdb.org/t/p/original/d0XyclHMeH9sBjay3sXvSKAWeFC.jpg,,낯선 땅 극한의 환경 속에서 사랑과 성공을 꿈꾸는 젊은 군인과 의사들을 통해 삶의 가치를 담아낸 블록버스터급 휴먼 멜로 드라마로 유럽의 발칸 반도에 위치한 가상 국가 우르크를 배경으로 전쟁과 질병으로 얼룩진 기상 이변 속에서 낯선 땅에 파병된 군인과 의사들을 통해 극한 상황 속에서도 사랑하고 연애하는 사람들의 전우애와 동기애를 담은 작품.,태양의 후예,2016-02-23 15:00:00,
65187,,5.9,https://image.tmdb.org/t/p/original/47bsaGWuKKnJnGz3nJIZDTpvhuV.jpg,,,MBC,b'\x00',https://image.tmdb.org/t/p/original/p2oqc4u0O8BqNLNS2EtBiPUUFq7.jpg,,해체된 1세대 요정 걸그룹인 엔젤스 멤버들은 이제 서른이 훌쩍 넘었다. 그리고 어쩌다 그녀들과 엮여버린 남자들. 그들은 다시 한번 행복해지기 위해 사랑에 도전한다.,한번 더 해피엔딩,2016-01-19 15:00:00,
65270,,0.0,https://image.tmdb.org/t/p/original/kCd0rmnNwCd3sgupO9DqSi9aHa0.jpg,,,MBC,b'\x00',https://image.tmdb.org/t/p/original/ofo50w2DTFcPkOm3iguWGU3Y8cw.jpg,,"2007년 5월 30일부터 MBC TV에서 방송되고 있는 예능 프로그램으로, 라디오 프로그램들의 '보이는 라디오'를 이용하여 들리는 TV로 콘셉트를 잡아 현재까지 방송되고 있는 코너이다. 진행자들은 각각 DJ로 불리며, 매주 다양한 게스트들을 초대해서 근황에 대해 여러가지 질문을 하고 답하는 리얼 토크쇼 프로그램이다. 개인별 초대손님의 경우 한 번에 최대 4명을, 그룹의 경우 최대 5명의 초대손님으로 최대 3회까지 녹화한다.",라디오스타,2007-05-29 15:00:00,
65282,,7.3,https://image.tmdb.org/t/p/original/gbmFzIEzl95x7QZfUYdY9QxJFJh.jpg,,,MBC,b'\x00',https://image.tmdb.org/t/p/original/a6eIDQKz2uIu69ABt87Evwn1kBP.jpg,,"대한민국 1인 가구 453만 시대! 이제는 1인 가구가 대세! 연예계 역시 1/3은 1인 가구! 기러기 아빠, 주말부부, 상경 후 고군분투중인 청년, 독신남 등 각기 다른 이유로 싱글족이 된 스타들! 당당한 1인 가구의 싱글라이프는 과연 어떤 것일까? 1인 가구가 트렌드가 된 현 시점에서 프로그램을 통해 사회적 공감대를 형성해본다.",나 혼자 산다,2013-03-21 15:00:00,
65355,,8.6,https://image.tmdb.org/t/p/original/leJUvDgCnEZ7ms7cC6LkyX0wcBe.jpg,,,MBC,b'\x00',https://image.tmdb.org/t/p/original/zfOGbggRqAMCm1hYrlFplOKKYVm.jpg,,"'수포자' 장단비가 수능시험일 물웅덩이로 조선에 떨어지고, 조선에서 만난 왕 이도와 벌이는 판타지 성장 로맨스이다. 실제 역사와 비교하면 말이 안되지만 고증을 생각하지 않고 생각없이 보면 가볍게 즐길 수 있는 판타지 드라마이다.",퐁당퐁당 Love,2015-12-12 15:00:00,
65412,,8.717,https://image.tmdb.org/t/p/original/nEZjqGJeNmXR2kKqcWl5PLfEZQb.jpg,,,SBS,b'\x00',https://image.tmdb.org/t/p/original/f7eTE3GvL4Lrt27MdUt9SmPHjAJ.jpg,,"일본 작가 아사다 지로의 츠바키야마 과장의 7일간이라는 작품을 원작으로, 쌈박하게 귀환한 저승동창생들의 이야기를 담은 휴먼 판타지 코믹드라마",돌아와요 아저씨,2016-02-23 15:00:00,
65728,,8.3,https://image.tmdb.org/t/p/original/jN4YIznDK35ZArl1cBc9gle0Vuy.jpg,,,MBC,b'\x00',https://image.tmdb.org/t/p/original/aohBKWnnpLNQVdpJKSw5VrT3tYv.jpg,,인생의 가치가 돈뿐인 남자와 삶의 벼랑 끝에 선 여자가 극적인 관계로 만나 진정한 사랑의 의미를 찾아가는 정통 멜로 드라마,결혼계약,2016-03-04 15:00:00,
65747,,6.3,https://image.tmdb.org/t/p/original/uCxjPolHVAgTh9wM8JOc1VfCYSK.jpg,,,tvN,b'\x00',https://image.tmdb.org/t/p/original/voCcDxb5k6nsyOiw1YGILmsIhPE.jpg,,"알츠하이머 선고 받은 로펌 변호사가 남은 인생을 걸고 펼치는 마지막 변론기이자, 기억을 잃어가면서도 끝내 지키고 싶은 삶의 가치와 가족애를 그린 작품",기억,2016-03-17 15:00:00,
66046,,8.7,https://image.tmdb.org/t/p/original/xDXaptzkHFHGyQ2QGZ3aGnEE1dK.jpg,,,MBC,b'\x00',https://image.tmdb.org/t/p/original/tEqL1b5NOhGUJgV62tyb6Q2gQtI.jpg,,"마스크를 쓰고 정체를 공개하지 않은채 무대에서 노래 실력을 뽐내는 음악 버라이어티 프로그램. 가수에게 계급장은 곧 인기다. 내가 좋아하는 가수의 노래는 더 좋게 들린다. 곡이 유명가수를 만나야 인기를 얻게 되는 이유도 바로 여기에 있다. 하지만 만약 인기라는 계급장을 떼고 진정한 노래 실력으로만 최고의 가수를 뽑는다면 누가 될까? 본 프로그램은 이러한 궁금증에서 시작되었다. 인기라는 편견을 버리고 진정성 있는 노래로 자신을 어필할 수 있는, 가수가 진정한 가수로 자리할 수 있는 무대. 바로 '복면가왕'이 희망하는 무대다. 그리고 이러한 '복면가왕'의 기본 정신은 시청자들에게도 목말라있던 진정성을 불러올 것이다. 우리가 잊고 있던, 우리가 미처 인정하지 못한 보컬리스트들의 대결이 시작된다.",일밤- 미스터리 음악쇼 복면가왕,2015-04-04 15:00:00,
66082,,8.101,https://image.tmdb.org/t/p/original/rQ5eoYS64dstZbyfiOAQNb9L2YE.jpg,,,tvN,b'\x00',https://image.tmdb.org/t/p/original/dYPBELz9pxdThm727tqWGlcX3hc.jpg,,"2016년 5월 tvN에서 방영을 시작한 드라마. ""모든 것은 오해로 시작되었다!"" '오해영'이라는 동명이인의 두 여자와 그들 사이에서 미래를 보기 시작한 남자 '박도경'이 미필적 고의로 서로의 인생에 얽혀가는 동명 오해 로맨스. 선택을 달리 할 타이밍이 온다. 앞으로 벌어질 일들이 머릿속에 스치듯이 보이기 시작한다면? 그런데 아무리 노력해도 상황이 바뀌지 않는다면? 그럼 이게 무슨 능력인데? 아무 능력도 아닌 거 아닌가. 그러다가 남자는 알게 된다. 마음만 변주를 줄 수 있다는 것을. 그 무엇 보다 마음이 제일 중요한 것이기에.",또 오해영,2016-05-01 15:00:00,
66240,,5.9,https://image.tmdb.org/t/p/original/cjosvDAWuNvMmJ9bmgmy0DFspoe.jpg,,,MBC,b'\x00',https://image.tmdb.org/t/p/original/9CUdxY6RStGQjIP81VL9ZhZ6D2I.jpg,,"옥에서 태어난 천재 소녀 옥녀와 조선상단의 미스터리 인물 윤태원의 삶을 그린 어드벤처 대하사극. 중궁전을 찾은 원형(정준호)에게 문정왕후(김미숙)는 아이의 존재에 대해 묻고, 원형은 걱정하지 말라고 하며 안심시킨다. 한편, 천득(정은표)은 가비(배그린)가 옥에서 낳은 아이의 이름을 옥녀라고 짓는데..",옥중화,2016-04-29 15:00:00,
66256,,7.033,https://image.tmdb.org/t/p/original/1nvdHIVrCuJahMAXYcSx2Mh9bPt.jpg,,,KBS2,b'\x00',https://image.tmdb.org/t/p/original/tUgHEXrYPjkzpY4aUCDg7YZh7uF.jpg,,"한 나라의 세자가, 내시와 사랑에 빠졌다! 츤데레 왕세자 이영과 남장 내시 홍라온의 예측불허 궁중위장 로맨스. 운종가에서 돈을 받고 연애상담을 해주는 여심전문가 홍라온! 정도령 대신 연서의 상대를 만나러 간 라온, 헌데 눈앞에 나타난 사람은 어여쁜 처자가 아닌 훤칠하고 잘생긴 사내 사내 옷을 입었지만 실은 여자인 라온에게 그들이 내민 것은 바로 내시계약서...!",구르미 그린 달빛,2016-08-21 15:00:00,
66271,,7.7,https://image.tmdb.org/t/p/original/z5xx5X1yIcFM308wQfA1V3nkMGr.jpg,,,MBC,b'\x00',https://image.tmdb.org/t/p/original/oAaYbqhmxmQD6Gdo9fvGRqujU0T.jpg,,"운명을 믿고, 미신을 맹신하는 심보늬와 수학과 과학에 빠져사는 공대 출신 게임회사 CEO 제수호가 벌이는 로맨틱 코미디. 동명의 웹툰 의 재치와 장점을 살리면서도 드라마로 재해석된 작품",운빨로맨스,2016-05-24 15:00:00,
66272,,6.925,https://image.tmdb.org/t/p/original/xeDuEXvNRkcyB4ANTpLObPOa8g3.jpg,,,KBS2,b'\x00',https://image.tmdb.org/t/p/original/oFi7YZuLWRE2K5ggkfBjVb60jrb.jpg,,"《함부로 애틋하게》는 KBS2에서 2016년 7월 6일부터 2016년 9월 8일까지 방영하였고, 2016년 첫번째 사전 제작 드라마인 '태양의 후예'에 이어, 두번째 사전 제작 드라마로 기획한 KBS 특별기획 드라마이다.",함부로 애틋하게,2016-07-05 15:00:00,
66329,,8.3,https://image.tmdb.org/t/p/original/fbAQzJw2mLYmf39L0c1SvijDwwv.jpg,,,SBS,b'\x00',https://image.tmdb.org/t/p/original/1lGKY3GOAZv38VKiC6cD6NrJNCi.jpg,,"과거의 상처를 딛고 의사가 된 두 남녀가 여러 인간 군상을 만나며 성장하고, 평생 단 한번뿐인 사랑을 시작하는 휴먼 메디컬 드라마.",닥터스,2016-06-19 15:00:00,
66330,,8.505,https://image.tmdb.org/t/p/original/iOyiuJhKlKY4tVT8EfJ1GwnM2By.jpg,,,MBC,b'\x00',https://image.tmdb.org/t/p/original/jtBo40RgHzihmYYzzqkPOXyux8.jpg,,"2016년 서울, 같은 공간 다른 차원을 교차하는 사건의 중심에 선 냉철한 천재 벤처재벌 강철과 활달하고 정 많은 외과의사 오연주가 펼치는 로맨틱 서스펜스 멜로 드라마",더블유,2016-07-19 15:00:00,
66387,,7.4,https://image.tmdb.org/t/p/original/9k6IHbEYlM07MYlwwM4PRe5M2cS.jpg,,,KBS2,b'\x00',https://image.tmdb.org/t/p/original/50DF27IJVz2cB4hFkuQb6geTUxE.jpg,,평소엔 쉽게 감정을 드러내지 않는 출중한 의술을 지닌 냉혈한 신경외과 의사 이영오가 어느 날 갑자기 시작된 환자들의 기묘한 죽음에 얽히기 시작하면서 한 여인을 만나 사랑에 눈뜨고 조금씩 바뀌어 나가며 인간성을 회복해 나가는 이야기를 그린 메디컬 드라마.,뷰티풀 마인드,2016-06-19 15:00:00,
66393,,8.0,https://image.tmdb.org/t/p/original/2gYZ0jQ7JKIukQSALPUXU7TZCbb.jpg,,,tvN,b'\x00',https://image.tmdb.org/t/p/original/wSNAMyfWVaHMfLdeGsA3cOTgrqX.jpg,,귀신을 볼 줄 아는 주인공과 주인공이 만난 귀신이 동거하며 겪어가는 에피소드를 그린 드라마. 귀신을 보는 능력을 없앨 돈을 벌기 위해 귀신을 때려잡는 '허당 퇴마사' 박봉팔(옥택연)과 수능을 못 치른 한으로 귀신이 된 여고생 김현지(김소현)가 동고동락하며 함께 귀신을 쫓는 이야기를 그린다.,싸우자 귀신아,2016-07-10 15:00:00,
66405,,8.0,https://image.tmdb.org/t/p/original/Qh4mAUCYA63nODcV00QMEyoyLE.jpg,,,OCN,b'\x00',https://image.tmdb.org/t/p/original/jaWOzmuUra5dBzJ4j6czmLYaI3R.jpg,,"“대한민국 헌법 제38조,

모든 국민은 법률이 정하는 바에 의하여 납세의 의무를 진다.”

하지만 위장전입, 탈세 등 온갖 위법을 저지르는 악덕 체납자들은 법을 비웃으며 자신들의 부를 축적하기 바쁜데..

이런 파렴치한 사람들을 응징하기 위해 공무원 X 사기꾼 콤비가 나섰다!

세금 징수 공무원 백성일과 사기꾼 양정도가 합심하여 상습적으로 탈세를 저지르는 이들의 세금을 징수하는 통쾌 사기극!

서민들의 아픔을 공유하는 ‘동병상련식’ 힐링이 아닌, 부도덕한 사람들을 혼쭐내는 ‘이이제이식’ 힐링으로 2016년 대한민국, 허탈한 시대를 살아가는 서민들을 위해 통쾌한 한방을 날릴 그들.

세금 징수 사기팀 〃38사기동대〃",38 사기동대,2016-06-16 15:00:00,
66433,,8.711,https://image.tmdb.org/t/p/original/i987SrMmgf7hk3EYAARHZ4q4KvX.jpg,,,SBS,b'\x00',https://image.tmdb.org/t/p/original/7Ji4MvbqOnAnwGJV5Z953AkuE0X.jpg,,"달 그림자가 태양을 검게 물들인 날. 상처 입은 짐승 같은 사내, 4황자(네번째 황자) ‘왕소’(이준기 분)와 21세기 여인 ‘고하진’(이지은 분)의 영혼이 미끄러져 들어간 고려 소녀 ‘해수’가 천년의 시공간을 초월해 만난다. 고려 건국 초. 태조의 과도한 혼인 정책이 부른 처절한 황위 다툼이 곧 예고 되지만, 아직은 청춘을 만끽 중인 8명의 황자들은 당찬 현대 여성의 영혼을 지닌 해수를 순식간에 주목한다. 황위를 둘러싼 치열한 궁중 암투 속에서 해수와 황자들의 인연은 끈끈하게 이어지고... 해수는 역사에 기록된 황자들의 운명에 끼어들 것인가 고민한다. 누구보다 장차 피의 군주 ‘광종’이 될 4황자 왕소. 차라리 만나지 않았으면, 그토록 고통스럽게 서로를 그리워하지 않았을 4황자와의 짙은 사랑이 고려 황실을 배경으로 아름답게 펼쳐지는데...",달의 연인 - 보보경심 려,2016-08-28 15:00:00,
66496,,8.185,https://image.tmdb.org/t/p/original/acN6aVNCRRkRf6XlxAADcVws6Tx.jpg,,,KBS2,b'\x00',https://image.tmdb.org/t/p/original/oxB2LOu6jH8pxRi6shblcXRmqBQ.jpg,,"1500년 전 신라의 수도 서라벌을 누비던 '꽃 같은 사내'인 화랑들의 뜨거운 열정과 사랑, 눈부신 성장을 그리는 청춘 사극",화랑,2016-12-18 15:00:00,
66560,,8.3,https://image.tmdb.org/t/p/original/juT3QolBt0wL9oUVGhEJny3L2s1.jpg,,,SBS,b'\x00',https://image.tmdb.org/t/p/original/qUY8VWskWSOWHWQeMBFj5ktvHuk.jpg,,질투라곤 몰랐던 마초기자와 재벌남이 생계형 기상캐스터를 만나 질투로 스타일 망가져가며 애정을 구걸하는 양다리 로맨스,질투의 화신,2016-08-23 15:00:00,
66634,,6.4,https://image.tmdb.org/t/p/original/44kNVRTeiXGxz80ggBSODh89Oa2.jpg,,,SBS,b'\x00',https://image.tmdb.org/t/p/original/8m4zp4wZVKlTa5Qt4m6Q9QZaTyV.jpg,,국내 최고 여배우가 납치된 아들을 찾기 위해 생방송 리얼리티 쇼에서 범인의 요구에 따라 미션을 수행하는 고군분투기가 담긴 리얼리티 스릴 드라마,원티드,2016-06-21 15:00:00,
67014,,7.3,https://image.tmdb.org/t/p/original/nhFi3zziBL6oLD2goDLX8PSXap1.jpg,,,JTBC,b'\x00',https://image.tmdb.org/t/p/original/o9eLDFcbEdEUr8aK7Un1blgvA2K.jpg,,"외모부터 성격, 전공, 남자 취향, 연애스타일까지 모두 다른 5명의 매력적인 여대생이 셰어하우스 벨 에포크에 모여 살며 벌어지는 유쾌하고 발랄한 청춘 드라마. 20대는 환히 빛날 줄만 알았다던 벨 에포크 친구들의 계속되는 동고동락. 돈 벌기, 연애, 그 무엇 하나 쉽지 않은 그녀들의 이야기.",청춘시대,2016-07-21 15:00:00,
67018,,7.2,https://image.tmdb.org/t/p/original/d84gSpBXdl7smdKlwnIWQPewEgs.jpg,,,SBS,b'\x00',https://image.tmdb.org/t/p/original/7JVD3DfLVFxk5nsfcTqjc7YFoQh.jpg,,"우리나라 최초의 야담집인 어우야담에 나오는 인어 이야기를 모티브로 한 판타지 로맨스 드라마. 1598년 8월 강원도 흡곡현, 신영 중이던 담령은 양씨의 여각에 하룻밤 머물게 되고, 여각 내부 정원에 자리 잡은 작은 연못에 갇힌 아름다운 인어와 눈을 마주하게 된다. 인어를 안타깝게 여긴 담령은 양씨의 죄를 빌미로 인어를 바다로 보내주게 되고... 긴 인연이 시작되는데....",푸른 바다의 전설,2016-11-15 15:00:00,
67050,,7.2,https://image.tmdb.org/t/p/original/dexPmTcqS9kJaMxsDvQl3GaPNun.jpg,,,SBS,b'\x00',https://image.tmdb.org/t/p/original/7KmByFAmHUW6Lz1sgIWoiduYyH4.jpg,,조선시대 사임당 신씨의 삶을 재해석해 그의 예술혼과 불멸의 사랑을 그린 드라마. 한국미술사 전공 시간강사 서지윤은 지도교수인 민 교수가 밀고 있는 안견의 금강산도 진위 논란에 휩싸인다. 민 교수의 심기를 건드린 지윤은 이태리 볼로냐 학회에서 낙오되고 거리를 헤매다 운명처럼 고서 한 권을 발견하는데...,"사임당, 빛의 일기",2017-01-25 15:00:00,
67084,,7.319,https://image.tmdb.org/t/p/original/HZLzCeiyos5erasKMZNspEfrY4.jpg,,,tvN,b'\x00',https://image.tmdb.org/t/p/original/62kxgQGr8X8vgNAUKXrrZ4GkXcP.jpg,,"감성그룹 회장과 인연으로 대저택 하늘집으로 들어온 수의사가 꿈인 씩씩한 여고생이 고집스럽고 자유로운 세 명의 도련님과 한 명의 경호원과 동거를 시작하면서 일어나는 일들을 담은 스무살 청춘들의 모험담을 그린 드라마. 대학 합격의 기쁨도 잠시, 모아놓은 등록금을 포기해야하는 상황에 놓인 하드캐리 신데렐라 하원(박소담). 하지만 운명처럼 찾아온 하늘그룹 첫째 현민(안재현)의 아르바이트 제안! 영문도 모른 채 현민에게 끌려간 곳에서, 첫만남부터 악연이었던 하늘그룹 둘째 지운(정일우)과 마주치고, 곤란한 상황에 빠지는데...",신데렐라와 네 명의 기사,2016-08-11 15:00:00,
67272,,7.992,https://image.tmdb.org/t/p/original/zgfw3ZgGkVkamz6nth8Vd9O2xN9.jpg,,,MBC,b'\x00',https://image.tmdb.org/t/p/original/vB17pXlKkuwLTnJelkrJonMPElq.jpg,,돈으로 무엇이든 살 수 있었던 남자. 쇼핑왕 루이가 날개 없는 천사 고복실을 만나 돈으로는 쇼핑 불가능한 사랑의 정서를 귀하게 얻어 가는 이야기,쇼핑왕 루이,2016-09-20 15:00:00,
67276,,9.2,https://image.tmdb.org/t/p/original/aJCi0t4DbvGO3U3lwz9HuAQr4hc.jpg,,,KBS2,b'\x00',https://image.tmdb.org/t/p/original/yx5MR25Cl5I8lVZM8CEDSYePsfY.jpg,,"삶에, 두 번째 사춘기가 온다. 삶의 중반, 인생의 반환점에 도달했지만 현실에 흔들리는 30대, 파도처럼 몰려오는 삶의 부침 속에서 우리에게 필요한 것은, 그저 작은 한 마디다. 순간의 기댐. 그 어떤 것들. 그리고 서슴없이 그것을 전하는 단 한 사람. 지금 이 사람이 꼭 필요하고, 이 사람이 주는 ‘위로’가 절실하다. 그래서, 노력한다. 보는 이들이 응원해주고 싶을 만큼. 세상에서 가장 따뜻한 위로, 가장 절절한 사랑이 온다!",공항 가는 길,2016-09-20 15:00:00,
67391,,7.35,https://image.tmdb.org/t/p/original/3xHzNBfXfzfd3cLZMhkwJCl4xR9.jpg,,,tvN,b'\x00',https://image.tmdb.org/t/p/original/uvjP2aIPwXExCs0jBubeHkU8uAo.jpg,,"전쟁 용병 출신의 보디가드 K2와 그를 고용한 대선 후보의 아내, 그리고 세상과 떨어져 사는 소녀! 로열패밀리를 둘러싼 은밀하고 강렬한 보디가드 액션 드라마",더케이투,2016-09-22 15:00:00,
67915,,8.728,https://image.tmdb.org/t/p/original/smSbK5cd8T9XHcxEUcems23BDEF.jpg,,,tvN,b'\x00',https://image.tmdb.org/t/p/original/qZMEiTsNlCQV27hHQE27ZtlPWyv.jpg,,"2016년 12월 tvN에서 방영을 시작한 드라마. 도깨비 설화를 모티브로 김은숙 작가가 3년 전부터 기획하였으며 사극과 현대극을 오가는 판타지적인 요소를 강조한 드라마이다. 당신이 세상에서 멀어지고 있을 때 누군가 세상 쪽으로 등을 떠밀어 주었다면, 그건 신이 당신 곁에 머물다 가는 순간이다.불멸의 삶을 끝내기 위해 인간 신부가 필요한 도깨비, 그리고 그와 기묘한 동거를 시작한 기억상실증 저승사자. 그런 그들 앞에 도깨비 신부라 주장하는 죽었어야 할 운명의 소녀가 나타나며 벌어지는 신비로운 낭만 설화.",쓸쓸하고 찬란하神: 도깨비,2016-12-01 15:00:00,
68250,,6.711,https://image.tmdb.org/t/p/original/rzD7FVPJ94GJYjpD2CsKDJDuK9W.jpg,,,tvN,b'\x00',https://image.tmdb.org/t/p/original/vM0BhKkY0OextIweDKCPrqpltSX.jpg,,"타고난 배경도, 안정된 직장도, 빵빵한 통장도, 집도, 차도, 몸만 와도 괜찮다는 남자도 없는, 서른 한 살의 아가씨, 마린. 인생의 반전을 꿈꿀 염치마저도 탱탱했던 피부와 함께 떠나보낸 지 오래. 하루가 다르게 쭉정이로 쭉쭉 진화 중이던 그녀 인생에 기적 같은 일이 벌어졌다. 완벽, 그 이상의 남자 소준. 마린이 염치불구 하고 할 수 있는 모든 상상을 총 동원해도 언감생심 꿈꿀 수 없는, 아니 꿈도 꿔선 안 될 수준의 남자가 마린에게 반해버리고 말았고, 결혼에까지 골인하게 된 것이다! 세상에 내가 신데렐라 팔자일 줄이야! 한반도 반만년 역사상 이렇게 시집 잘 간 여자가 또 있을까? 하지만, 그 감격은 결혼한 지 일주일도 채 지나지 않아 산산이 깨져버리고야 만다. 부부는 일심동체라는데, 남편이 자신에 대해 감추고 있는 비밀이 너무나 많았던 것. 알면 알수록, 파면 팔수록 그의 정체는 미스터리하기만 한데...",내일 그대와,2017-02-02 15:00:00,
68349,,8.712,https://image.tmdb.org/t/p/original/zoyAniOyCnlkys5ra9EbzVyPuiv.jpg,,,MBC,b'\x00',https://image.tmdb.org/t/p/original/ssKVvJM341QiRdBmj8fOAOcpYdl.jpg,,"바벨만 들던 스물한 살 역도선수 김복주에게 닥친 폭풍 같은 첫사랑을 그린 감성 청춘 드라마. 바벨만 들던 스무살 역도선수 김복주에게 폭풍 같은 첫사랑이 닥친다. 그녀, 굳은 살 박힌 제 손이 처음으로 부끄럽다. 그녀, 사랑 앞에 처음으로 여자이고 싶다. 꿈과 목표를 향해 달려가는 체대생들의 치열한 인생 성장기, 서툰 천사랑에 관한 에세이. 우리 모두 그 지점을 지나왔다. 청춘을 응원한다.",역도요정 김복주,2016-11-15 15:00:00,
68398,,8.4,https://image.tmdb.org/t/p/original/mhsu36Imq3GbtQSSmjmJGrDHAkE.jpg,,,SBS,b'\x00',https://image.tmdb.org/t/p/original/nVWbufNA7ViMRPXNzwRH5nTiB7w.jpg,,"지방의 초라한 돌담 병원을 배경으로 벌어지는 '괴짜 천재 의사' 김사부와 열정이 넘치는 젊은 의사 강동주, 윤서정이 펼치는 '진짜 닥터' 이야기. 인수는 동주에게 커피 심부름을 시키지만 ‘언터처블 인턴’이란 소문대로 동주는 꼼짝 않고, 서정은 그런 동주를 호기심 있게 지켜본다. 한편, 응급실로 실려온 공사장 붕괴사고 환자들! 누가 더 급한 환자인지를 두고 서정과 동주 사이에 마찰이 생기는데...",낭만닥터 김사부,2016-11-06 15:00:00,
68666,,6.75,https://image.tmdb.org/t/p/original/eDVOq39zb5F5zI8vtzdzTqLNmyp.jpg,,,MBC,b'\x00',https://image.tmdb.org/t/p/original/qqevzABDwiXg3o1as3kXmNucFEL.jpg,,"고생해서 출가시킨 4남매가 다시 부모의 품으로 유턴하면서 벌어지는 명랑, 속상(?)한 이야기! 뼈 빠지게 고생해 드디어 4남매 모두를 출가시키고 홀가분한 여생을 보내려던 형섭과 정애부부. 함께 스포츠 댄스도 배우고 선상 크루즈 여행도 떠날 생각에 정애는 콧노래가 절로 난다. 그러던 어느 날... 마른 하늘에 날벼락보다도 더 심각한 사태가 벌어진다. 이들의 4남매가 동시에 다시 집으로 돌아온 것이다..!!",아버님 제가 모실게요,2016-11-11 15:00:00,
68814,,8.1,https://image.tmdb.org/t/p/original/mYMoUAWlM3duYXrbQag0xxs7JbR.jpg,,,JTBC,b'\x00',https://image.tmdb.org/t/p/original/zUeMFnFJKPqe8lNdUYl7oxrwSZ3.jpg,,"인간이 사는 세상은 정글이나 다름없다. 혼돈속의 질서를 바로잡는 법과 인간의 내재된 양심이 동물들이 지배하는 정글과의 차별점이긴 하나 처절한 약육강식, 힘의 논리 하에 움직이고 있음이 사실이다. 여성의 사회적 지위나 실존적 권위가 날이 갈수록 커지고 있다. 하지만 그 이면에는 추락하는 남성의 권위를 물리적 힘으로 가압하려는 역행성 범죄와 심리들 또한 보이지 않게 증가하고 있다. “남자가 여자보다 나은 점은 털 많고 근육 많은 것 밖에 더 있어?” 라고 외치던 여자팀장은 늦은 밤 회식 후 남자 부하직원이 집 앞까지 에스코트 해주는 아이러니에 놓인다. 왜냐 그 털 많고 근육 많은 남자의 물리적 힘이 나쁜 남자 인간들에 의해 나쁘게 쓰이고 있기 때문이다. 여자는 그래서 털 많고 근육 많은 그러나 좋은 남자에게 한없이 끌린다. 자기가 가지지 못한 걸 가지고 있어서다. 만일 여자가 남자보다 힘이 세다면 세상은 어찌 되었을까? 이 발칙한 상상에서 출발한 이야기가 세상 사람들에게 호쾌하고 통렬한 다이돌핀을 줄 거라는데 난 조금도 망설임 없는 확신을 하며 드라마를 기획하였다.",힘쎈여자 도봉순,2017-02-23 15:00:00,
