program_id,age,average_rating,backdrop_path,broadcasting_day,broadcasting_episode,broadcasting_station,end_flag,poster_img,rating_cnt,summary,title,first_air_date,bookmark_cnt
95485,,7.8,https://image.tmdb.org/t/p/original/v8wRXTxqxlmdhU1ON6aRqxOpOIL.jpg,,,MBC,b'\x00',https://image.tmdb.org/t/p/original/tPf7FGhGwiVGODOPlC1ZU4YSiNH.jpg,,"죽음 직전의 순간을 보는 예언가와 강력반 형사가 의문의 연쇄 살인 사건에 휘말리게 되면서 숨겨진 비밀을 파헤쳐가는 이야기를 그린 드라마. 20년 전, 7명의 여학생을 생매장해 죽음에 이르게 한 0시의 살인마가 돌아왔다? 사람의 눈을 보면 그 사람의 죽음 직전의 순간을 보는 태평(옥택연)은 처음으로 죽음이 보이지 않는 강력계 형사 준영은 처음으로 죽음이 보이지 않는 강력계 형사 준영(이연희)을 만나게 되고. 우연히 마주친 여학생이 오늘 자정, 0시에 죽음에 이른다는 사실을 알게 되는데...",더 게임: 0시를 향하여,2020-01-21 15:00:00,
95554,,8.0,https://image.tmdb.org/t/p/original/eVE0YzJpolG1ssjaiE1bHxScNMa.jpg,,,Channel A,b'\x00',https://image.tmdb.org/t/p/original/z7A2lqtxbIPUAUsT4J0LyTy8bRa.jpg,,"메이크업은 우리 삶과 닮았다. 단점은 가리고 약점은 숨기고 메이크업을 하듯  우리는 남들에게 보다 나은 모습을 보여주려 애쓴다.

하지만 이 드라마는 메이크업을 통해 우리 진짜 모습을 보여주는 걸 너무 걱정하지 말자고

스스로에게 당당하고 나를 아끼는 사람이 되자고 이야기하고자 한다.",터치,2020-01-02 15:00:00,
96102,,9.0,https://image.tmdb.org/t/p/original/9iypSe1gvjExzZJL0JNR80x5OTS.jpg,,,tvN,b'\x00',https://image.tmdb.org/t/p/original/84FXZmqTRW2LBYUVwSZSU1o7FJI.jpg,,"누군가는 태어나고 누군가는 삶을 끝내는 탄생과 죽음이 공존하는, 인생의 축소판이라 불리는 병원에서 평범한 듯 특별한 하루하루를 살아가는 사람들과 눈빛만 봐도 알 수 있는 20년지기 친구들의 케미스토리를 담은 드라마",슬기로운 의사생활,2020-03-11 15:00:00,
96121,,0.0,https://image.tmdb.org/t/p/original/kHf4JUi1X7XlRapCtnQcZ4Q1my2.jpg,,,SBS,b'\x00',https://image.tmdb.org/t/p/original/mRyfvMzwBplfiL9C2ItG5RYViLr.jpg,,변신 자동차 로봇 애니메이션,헬로카봇,2014-08-01 15:00:00,
96160,,8.563,https://image.tmdb.org/t/p/original/u9BncsRESGAHicN67G7z6FlAQ3K.jpg,,,Netflix,b'\x00',https://image.tmdb.org/t/p/original/lVBwQpgNItuUySXJoUg9B0VZxOL.jpg,,"안면인식장애를 가진 소연과 인간미 넘치는 다정하고 완벽한 인공지능 비서 홀로, 그와 얼굴은 같지만 성격은 정반대인 까칠한 천재 발명가 난도가 서로를 만나, 사랑할수록 외로워지는 불완전한 로맨스를 그린다. 늘 혼자인 그녀의 곁으로.",나 홀로 그대,2020-02-06 15:00:00,
96162,,8.5,https://image.tmdb.org/t/p/original/rtYQCa2NzX8RspbOmwfAla6BemO.jpg,,,JTBC,b'\x00',https://image.tmdb.org/t/p/original/48mmYEnz61rnvMVXhqcdcgmo68p.jpg,,"불합리한 세상 속, 고집과 객기로 뭉친 청춘들의 ‘힙’한 반란이 시작된다. 세계를 압축해 놓은 듯 한 이태원. 이 작은 거리, 각자의 가치관으로 자유를 쫓는 그들의 창업 신화. 박새로이는 무릎 한 번을 꿇지 못해서 고등학교 중퇴, 전과자가 되었다. 재벌의 갑질로 인해 꿈, 가족 모두를 잃고 끝없는 나락 속에서 우연히 걷게 된 이태원 거리. 다양한 인종, 느낌 있는 이국적인 건축물, 자유로운 사람들, 각국의 맛있는 요리들. 세계가 압축된 듯한 이태원에서 자유를 느낀 그는, 다시금 희망을 품고 반해버린 이곳 이태원 골목에서 뜻이 맞는 동료들과 창업을 시작한다.",이태원 클라쓰,2020-01-30 15:00:00,
96164,,8.0,https://image.tmdb.org/t/p/original/lBOyED4YXsqCIQfHeqMz4PTdUDY.jpg,,,JTBC,b'\x00',https://image.tmdb.org/t/p/original/xbGz8GKZNv824UgsL4cpKV0WMuV.jpg,,"사랑이라고 믿었던 부부의 연이 배신으로 끊어지면서 복수의 소용돌이에 빠지는 이야기. 피 한방울 섞이지 않은 두 사람이 가족이란 울타리를 만들어 서로의 인생을 섞어 공유하는 그 이름. 부부. 이토록 숭고한 인연이 ‘사랑’이라는 약한 고리로부터 기인한다는 것. 곱씹을수록 간담 서늘하다. 사랑은 무한하지도 불변하지도 않기 때문이다. 부부의 연을 맺으며 우리는 약속했었다. 너만을 사랑하겠노라고. 그러나, 약속은 버려졌고, 사랑은 배신당했다. 배신으로 시작된 증오 그리고 이어지는 서로를 향한 복수. 복수에는 응분 대가가 따르는 법. 복수란 상대뿐 아니라 자신까지 파괴하는 것이란 걸 알아야만 했다. 나 하나 부서지는 것쯤이야 기꺼이 감내할 수 있었다. 허나, 가장 소중한 것까지 잃게 될 줄은 몰랐다. 상대를 파괴할 만큼 증오한다는 것은 사랑의 또 다른 형태. 이것은 죽을힘을 다해 서로의 목을 조이는 치열한 사랑에 관한 이야기이다.",부부의 세계,2020-03-26 15:00:00,
96462,,8.619,https://image.tmdb.org/t/p/original/uDadf0pmGDXgkiRP7xJICWkSHVV.jpg,,,tvN,b'\x00',https://image.tmdb.org/t/p/original/1uBz58vwQymBfDZuLHwHe4dsOOM.jpg,,"돈도 없고, 부모도 없고, 희망조차 없는 정신병동 보호사. 그에게 있는 거라곤 자폐 스펙트럼인 형 하나. 그저 한 달 월급으로 형과 배불리 먹고 두 다리 뻗고 잘 수만 있다면 그것으로 족하다는 남자 앞에 동화 속 마녀와 같은 이상한 여자 하나가 불쑥 등장한다. 칼 대신 펜을 휘둘러 동심을 지배하고 조종하는 아동문학계의 여왕. 더군다나 선천적 결핍으로 사랑의 감정을 알지 못하는 그녀가 하필 사랑을 거부하는 남자에게 운명적으로 꽂혀 버린다. 그렇게 시작된 피가 튀고 살이 에이는 전쟁 같은 밀당. 과연 이들의 살벌하면서도 아름다운 잔혹동화는 해피엔딩을 향해 갈 수 있을까?",사이코지만 괜찮아,2020-06-19 15:00:00,
96571,,7.842,https://image.tmdb.org/t/p/original/cGo6zneYqHppIxotsADM98bw5IZ.jpg,,,Netflix,b'\x00',https://image.tmdb.org/t/p/original/drEK6iGpzQBzFCmiT5KiG3s8ktO.jpg,,"사람이 세상을 떠나도, 그들의 물건은 남는다. 거기엔 생전의 삶이 깃들어 있다. 아스퍼거 증후군이 있는 청년과 출소한 그의 삼촌. 세상에 대해 일말의 기대도 없이 살아온 두 유품정리사가 고인의 못다 말한 이야기를 듣는다.",무브 투 헤븐: 나는 유품정리사입니다,2021-05-13 15:00:00,
96648,,8.519,https://image.tmdb.org/t/p/original/mceCXNTny6a5F3rQgShLoyARw4l.jpg,,,Netflix,b'\x00',https://image.tmdb.org/t/p/original/eNfNu9sJ2eVmMcbrKpgEovPoyB8.jpg,,"끔찍한 사고로 가족을 모두 잃은 외톨이 고등학생 현수는 그린 홈이라는 낡은 아파트 단지로 이사한다. 절망에 빠진 그는 점차 그린 홈에 관한 비밀을 깨닫는다. 왜곡된 인간 욕망을 여러 가지 형태로 투영하면서 인류를 몰아내려는 괴물이 그린 홈을 둘러싸고 있으며, 자신을 포함해 그린 홈 주민들은 그 괴물들에 갇혀있다는 사실을.",스위트홈,2020-12-17 15:00:00,
96777,,7.905,https://image.tmdb.org/t/p/original/9hNJ3fvIVd4WE3rU1Us2awoTpgM.jpg,,,Netflix,b'\x00',https://image.tmdb.org/t/p/original/syYduNOCirN544TIQcdy0aOyXFp.jpg,,각계 전문가들이 한 팀이 되어 달 탐사선에 오른다. 임무는 폐쇄된 연구기지에서 24시간 안에 중요 샘플을 회수하는 것. 대원들은 비밀에 잠긴 이 위험천만한 기밀 미션을 완수할 수 있을까.,고요의 바다,2021-12-23 15:00:00,
96977,,8.5,https://image.tmdb.org/t/p/original/6MFfJBuBj2PoCrRtZrom6YeT2cV.jpg,,,JTBC,b'\x00',https://image.tmdb.org/t/p/original/2SpLILOO9ODAi2te1xN3C0dbED9.jpg,,첼로를 가르치던 일을 그만둔 해원은 호두하우스 펜션을 운영하는 이모 곁에서 한동안 지내기로 한다. 노부부가 살던 기와집이 작은 서점 ‘굿나잇 책방’으로 바뀐 걸 보고 의아해하는 해원. 논두렁 스케이트장에 있던 은섭은 그의 책방을 기웃거리는 해원을 보고 멈칫 놀라는데...,날씨가 좋으면 찾아가겠어요,2020-02-23 15:00:00,
97219,,8.173,https://image.tmdb.org/t/p/original/oNn65nwVPP8bkRYVv9TmaxdmWgY.jpg,,,Netflix,b'\x00',https://image.tmdb.org/t/p/original/tlw8nchFjYK2JuwFs7V2jcxNtTK.jpg,,"갑작스러운 사고로 가족의 곁을 떠나게 된 주인공이 사별의 아픔을 딛고 새 인생을 시작한 남편과 딸아이 앞에 다시 나타나면서 벌어지는 고스트 엄마의 49일 리얼 환생 프로젝트를 그린 드라마. 귀신 5년차가 무색할 만큼 상큼발랄한 아내 귀신(차유리)과 죽은 아내를 그리워하며 고통 속에 살다, 새 인생을 시작한 남자(조강화)가 있다. 이 부부를 통해 삶과 죽음, 이 거스를 수 없는 순리와 상실이 우리에게 전하는 메시지를 되짚어보고 그들이 겪은 시간과 상처들을 이야기하려 한다.",하이바이 마마,2020-02-21 15:00:00,
97267,,8.0,https://image.tmdb.org/t/p/original/v01S6x490PLKVat95l3xL7Y8UqD.jpg,,,SBS,b'\x00',https://image.tmdb.org/t/p/original/whbOqpjzFV8IcLQIuF6mGplrRYA.jpg,,죽음으로 인해 영원한 이별을 하게 된 남녀가 시간과 차원의 한계를 넘어 마법처럼 다시 만나게 되면서 벌어지는 이야기,앨리스,2020-08-27 15:00:00,
97565,,7.625,https://image.tmdb.org/t/p/original/tqOO3QzQkGT0gH0EjuTUwGFaoXY.jpg,,,KBS2,b'\x00',https://image.tmdb.org/t/p/original/oHsoZiz5SNrerTTg39g1i8jnC84.jpg,,"현실적인 욕망을 지닌 인물들이 각자 행복하지 않은 기억으로 입은 마음의 상처를 숲이란 공간에 모여들면서 치유해나가고 행복의 본질을 깨닫는 내용을 그린 드라마. 냉철한 M&A전문가 강산혁(박해진)은 환상통 때문에 큰 거래를 놓치게 되고, 진료를 위해 방문한 서울명성병원에서 열혈 의사 정영재(조보아)를 만난다. 서로의 잘난 척에 질려 다신 볼일 없을 것 같던 산혁과 영재는 운명적인 사건으로 미령숲에서 다시 마주 치는데...",포레스트,2020-01-28 15:00:00,
97765,,8.375,https://image.tmdb.org/t/p/original/ix62uSYRdCJWicyn2HU4NQqGfti.jpg,,,KBS2,b'\x00',https://image.tmdb.org/t/p/original/rFiUxmLxzg98VxJFve9GfFtHLZ.jpg,,"열여덟살 전문계 학교 고등학생들의 적나라한 학교 생활과 청춘 고민, 또 어른들이 몰랐던 이들의 막막한 생존에 대한 이야기",학교 2021,2021-11-23 15:00:00,
97766,,7.4,https://image.tmdb.org/t/p/original/h31iY3429ivyMCRr9gyt2msBECn.jpg,,,Netflix,b'\x00',https://image.tmdb.org/t/p/original/odeAVdSnvzC3r4NzjK7MyKKeJ3J.jpg,,"동명의 웹툰이 원작이며 바이오 생명공학 기술로 특별한 능력을 얻은 인간 병기들이 모인 특수조직 '루갈'이 대한민국 최대 테러집단 '아르고스'에 맞서 싸우는 액션 히어로 드라마. 황득구(박성웅)을 필두로 한 국내 최대의 범죄 조직 아르고스! 이들을 쫓던 형사 강기범(최진혁)은 임무 수행 중 아르고스의 습격을 받아 동료들과 사랑하는 아내, 자신의 두 눈마저 잃게 된다. 아르고스의 범행이라고 주장하지만 증거가 불충분한 상황. 기범은 아내를 죽이고 두 눈을 자해한 살인마로 낙인 찍혀 교도소에 수감된다. 그러던 중, 새로운 눈을 주겠다는 은밀한 제안에 목숨을 건 교도소 탈출을 감행하는데...",루갈,2020-03-27 15:00:00,
97957,,7.9,https://image.tmdb.org/t/p/original/qMYTF2XVzLgYxaxxETddjTsO8vV.jpg,,,KBS2,b'\x00',https://image.tmdb.org/t/p/original/w1OMN8aFc0dNJxAgYzPBxcK5Xqs.jpg,,"인간 남자로 변신하는 고양이 홍조와 강아지 같은 인간 여자 솔아의 미묘한 설렘을 다루는 판타지 로맨틱 코미디 드라마. 재선의 헤어진 여자친구의 고양이를 맡게 된 솔아. 한편, 고양이 홍조는 사람이 되고 싶다고 생각한 순간 정말로 사람이 되어버리는데... 도대체 왜, 어떻게 해야 사람이 되는지 이유를 알 수 없다. 그러나, 솔아의 곁에서 계속 사람이 되고, 바로 이 사람이 나를 사람으로 만든다.",어서와,2020-03-24 15:00:00,
97970,,8.784,https://image.tmdb.org/t/p/original/4DTKH7meyXpgZgKL4ubkEsg5aSk.jpg,,,Netflix,b'\x00',https://image.tmdb.org/t/p/original/4HJq3y539fnuCN9Fn8Vwqgukvhm.jpg,,2022년 9월 Netflix에서 방영을 시작한 범죄물. 남미에서 마약 조직을 운영하는 한국인 마약왕. 그를 체포하려는 정부의 비밀 작전에 한 평범한 사업가가 합류한다.,수리남,2022-09-08 15:00:00,
98827,,7.323,https://image.tmdb.org/t/p/original/radnXkgRgn1RMbaddv3ZYbCZ3G6.jpg,,,SBS,b'\x00',https://image.tmdb.org/t/p/original/pnqkwJXSMC89P2wORtNAMTEE8lF.jpg,,"똘기 충만 4차원 알바생과 허당끼 넘치는 훈남 점장이 편의점을 무대로 펼치는 24시간 예측불허 코믹 로맨스. 키 크고 훤칠한 훈남이자 따뜻한 마음의 소유자, 최대현. 상큼한 미모와 4차원 성격의 똘끼 소유자, 정샛별. 3년 전 담배 셔틀로 만나는 두 사람 “웬만하면 끊어 뼈 삭는다. 그런 거 말고 멋진 일에 청춘을 걸어 봐!”라고 말해주는 최대현. 그날 대현은 샛별에게 잊을 수 없는 사람으로 각인되게 되는데...",편의점 샛별이,2020-06-18 15:00:00,
99047,,8.354,https://image.tmdb.org/t/p/original/18ypvPahjmmue1iR4N4YgTBrO8N.jpg,,,tvN,b'\x00',https://image.tmdb.org/t/p/original/iuYfsWFLdrWhdIkkmbtFQDCf6e7.jpg,,"현실의 벽에 절망하지 않고 스스로 꿈과 사랑을 이루기 위해 노력하는 청춘들의 성장 기록을 담은 드라마. 모델에서 배우라는 꿈을 향해 열심히 달려가고 있는 혜준. 하지만 그 길은 험난하기만 하다. 믿었던 에이전시 대표 태수에게 발등 찍히고, 같은 꿈을 꾸는 친구 해효와 비교당하기 일쑤. 그런 혜준 앞으로 입영통지서가 날아오는데...",청춘기록,2020-09-06 15:00:00,
99048,,8.372,https://image.tmdb.org/t/p/original/8NK9un1DPUTgRzGtJHMvpdIB5Ay.jpg,,,tvN,b'\x00',https://image.tmdb.org/t/p/original/hq55ekoWj3zHfBM8RoyxYcw64l3.jpg,,"꿈을 현실로, 불가능을 가능으로! 아이디어 있겠다, 기술 있겠다. 못 할 것도 없지. 치열한 스타트업의 세계에 뛰어드는 젊은 창업자들. 성공도 사랑도 쟁취하고야 만다. 초라한 계약직 서달미는 15년 전 편지 속 첫사랑 남도산을 찾아야 한다. 잘나가는 CEO가 된 친언니 원인재의 앞에서 떤 허세 때문에! 그리고 그 허세 때문에 고단해지는 한남자 한지평이 있었으니...",스타트업,2020-10-16 15:00:00,
99112,,8.0,https://image.tmdb.org/t/p/original/uFeHOLcOtjjtvXJkYaD0xOVF28g.jpg,,,tvN,b'\x00',https://image.tmdb.org/t/p/original/1GRmTq4zAoV2LSHwWOH42x8lelI.jpg,,"인공지능 프로그래머 하원과 클래식 녹음 엔지니어 서우가 만나 그리는 시작도, 성장도, 끝도 자유로운 짝사랑 이야기. AH의 대표이자 인공지능 프로그래머인 하원. 자신의 인격을 넣은 대화용 디바이스를 테스트 중이다. 하원은 지수와의 추억이 있는 노래를 따라 우연히 들어간 녹음실에서 클래식 녹음 엔지니어 한서우를 만나게 된다. 그리고 서우와의 만남 이후, 디바이스는 하원의 인격으로 활성화되는데... 한편, 서우는 새로 온 녹음실 관리자 문순호로부터 김지수의 그릇을 사 달라는 이상한 부탁을 받는다.",반의 반,2020-03-22 15:00:00,
99477,,8.083,https://image.tmdb.org/t/p/original/3N6effQUWb64LeWUflfiB59BXNW.jpg,,,MBC,b'\x00',https://image.tmdb.org/t/p/original/uQhpgk9Gy0GiWisb3Y8Vmunhx8j.jpg,,"과잉 기억 증후군으로 1년 365일 8760시간을 모조리 기억하는 남자와 삶의 중요한 시간을 망각해버린 여자, 같은 상처를 가진 두 사람이 운명처럼 만나 서로를 사랑하게 되는 이야기를 담은 로맨스 휴먼 멜로 드라마. HBN 뉴스 라이브 앵커 이정훈(김동욱). 라이징 스타 배우 여하진(문가영). 전혀 다른 두 사람의 만남이 시작된다! 영화 홍보차 뉴스 라이브에 초대받게 된 하진. 예측불가! 그녀의 돌발행동으로 인해 정훈은 난감한 상황에 놓이게 되는데...",그 남자의 기억법,2020-03-17 15:00:00,
99478,,8.2,https://image.tmdb.org/t/p/original/gbOXdzgPB3arFURiE9lbDRRF31w.jpg,,,tvN,b'\x00',https://image.tmdb.org/t/p/original/bDWpp6AAfNGLaDmrmhkyt7hUvFq.jpg,,"기억을 읽는 국가공인 초능력 형사 동백. 거듭된 폭행 시비로 정직당하는 그때, 희대의 납치 연쇄살인이 발생한다. 사건을 처음 간파한 최연소 엘리트 총경 한선미는 천재적 프로파일링을 통해 범인을 추적하고, 동백 역시 납치 피해자를 구하기 위해 파면을 무릅쓴 채 은밀히 사건에 뛰어드는데...",메모리스트,2020-03-10 15:00:00,
99479,,7.64,https://image.tmdb.org/t/p/original/valKkzJxBlP0WGx3qyRfQqJ3L9x.jpg,,,MBC,b'\x00',https://image.tmdb.org/t/p/original/hivTCkAfb2tc5RhlnJl3j37KsRI.jpg,,"과거로 돌아가 인생을 반복해서 살 수 있는 '리셋'의 기회를 얻은 사람들. 꿈만 같은 시간을 보내던 그들에게 예측불허의 일들이 펼쳐진다. 과거를 바꾸기 시작하면서 그들 앞에는 예측불허한 일들이 펼쳐진다. '리셋'의 대가를 치르라는 듯, 차례로 찾아오는 죽음의 그림자. 살아남은 사람들은 생존을 위해 사건을 추적하기 시작하는데...",365 : 운명을 거스르는 1년,2020-03-22 15:00:00,
99480,,8.9,https://image.tmdb.org/t/p/original/2kmVjjuAJqx7SQwMLHgkWCCHVSi.jpg,,,JTBC,b'\x00',https://image.tmdb.org/t/p/original/51iYzWkefsyFv6aEirPuzUScXxY.jpg,,"5년 전 여대생과 형사를 살해한 범인을 추호의 의심 없이 체포했던 형사 강도창! 5년 후, 엘리트 형사 오지혁이 강력 2팀으로 전입해 오면서 잊혀졌던 진실을 향한 증거들이 드러나기 시작한다. 진실에 다가가려는 자와 은폐하려는 자들 간의 불꽃 튀는 대결이 시작된다!",모범형사,2020-07-05 15:00:00,
99489,,8.696,https://image.tmdb.org/t/p/original/lUseDQFZoge6GR1F6dGtaARiF7M.jpg,,,SBS,b'\x00',https://image.tmdb.org/t/p/original/33WzWRlmxjpW00zOGin6qrx6iqU.jpg,,"강남의 상징인 최고층 펜트하우스 입성을 향해 인생을 걸고 질주하다 점점 괴물로 변해가는 한 여자의 일그러진 욕망과 모성, 부동산 성공 신화 이야기. 우연히 목격한 살인사건에 침묵하는 조건으로 최고급 부동산 정보를 얻게 된 주인공이 강남행 마지막 티켓을 거머쥐고 상류사회에 끼어들어 부동산과 교육, 돈과 지식 두 가지를 다 성공하기 위해 완전히 다른 삶을 선택하는 이야기.",펜트하우스,2020-10-25 15:00:00,
99490,,7.938,https://image.tmdb.org/t/p/original/trOVoa8uRgD3HkZFtbldFQ0B6Xk.jpg,,,KBS2,b'\x00',https://image.tmdb.org/t/p/original/yNtwQZx9IcAuY1lUdx0npJqPUVK.jpg,,"바람 잘 날 없는 송가네의 파란만장한 스토리로, 이혼으로 시작해 결국 사랑과 가족애로 뭉치는 송가네 식구들과 사람 사는 냄새 풍기는 시장 사람들의 이야기를 다루는 작품. 용주시장에서 닭집을 운영하는 옥분은 요즘 행시 출신 5급사무관 영훈과 결혼할 막내딸 다희 때문에 어깨 뽕이 하늘을 찌른다. 정작 결혼 당사자인 막내딸 다희는 인턴생활에 쪼들려 결혼 준비는커녕 잡일에 시달려 잠잘 시간도 없이 바쁘기만 하고. 소아병원 내과의인 둘째딸 나희는 같은 병원에서 근무 중인 남편 규진과 점점 파국에 치닫는 결혼생활 때문에 지쳐만 간다. 마침내, 정신없이 결혼식을 치른 막내딸 다희는 상상 초월할 광경을 목격하는데...",한번 다녀왔습니다,2020-03-27 15:00:00,
99491,,8.233,https://image.tmdb.org/t/p/original/6MBRKVIEvtWMSf7iwt0oivylzPD.jpg,,,JTBC,b'\x00',https://image.tmdb.org/t/p/original/4xjtsQgxLkVKfkig5p6MoVoz6PH.jpg,,"늦은 밤, 낯선 곳에 나타나는 의문의 포장마차와 그곳에서 벌어지는 이야기. 야심한 밤, 어디선가 누군가에 힘든 일이 생기면 나타나는 의문의 포장마차. 월주 이모가 따라주는 신묘한 술을 마시면 갑갑한 현실에 솟아날 구멍이 보인다는 그곳. 터치만 했다하면 남의 속마음이 들리는 특이체질 강배는 쌍갑포차를 찾게 되는데...",쌍갑포차,2020-05-19 15:00:00,
99494,,8.188,https://image.tmdb.org/t/p/original/ocJbIvw7Xe64CZIYhcxYfXhX4wn.jpg,,,tvN,b'\x00',https://image.tmdb.org/t/p/original/h4GrN8XJLRBqxJPyx46rYs4olmn.jpg,,"14년간 사랑해 온 남편이 피도 눈물도 없는 연쇄살인마로 의심된다면? 사랑마저 연기한 남자 희성과 그의 실체를 의심하기 시작한 아내 지원. 외면하고 싶은 진실 앞에 마주 선 두 사람의 고밀도 감성 추적극. 희성은 이대로가 좋다. 사랑스러운 아내. 애교쟁이 딸. 직접 만든 금속공예품들이 진열된 번듯한 공방. 모든 일상이 완벽하게 평범했다. 그의 공방에 예기치 못한 방문객이 찾아오기 전까진. 강력계 형사 지원은 희성의 생일파티 날 걸려온 긴급 호출로 아동 살인미수 사건을 조사하게 되고, 같은 사건을 쫓던 기자 무진이 지원의 소개로 희성의 공방을 찾아오는데...",악의 꽃,2020-07-28 15:00:00,
99654,,8.518,https://image.tmdb.org/t/p/original/hGtx3dAB6x0ShXpDk4BBvt74Mtx.jpg,,,JTBC,b'\x00',https://image.tmdb.org/t/p/original/djWxHGEz6RCGf68mmJxf4igj4n6.jpg,,"2001년 고등학생 대영은 국가대표 농구선수를 목표로 하고 있는 유망주, 농구밖에 모르는 그가 어린 다정에게 첫눈에 사랑에 빠진다. 두 사람은 연인으로 발전하고 뜻하지 않은 임신으로 쌍둥이의 부모가 됐다. 18년 후 꿈을 포기하고 열심히 살아온 대영에게 다정은 이혼을 요구한다. 대영은 자포자기하는 마음으로 체육관에서 공을 던지는데 갑자기 정전이 됐다, 그때부터 사람들이 대영을 학생이라고 부르기 시작하는데…",18 어게인,2020-09-20 15:00:00,
99966,,8.434,https://image.tmdb.org/t/p/original/8Xs20y8gFR0W9u8Yy9NKdpZtSu7.jpg,,,Netflix,b'\x00',https://image.tmdb.org/t/p/original/d9yefq8dNke4UbuqStBtUcO9TxD.jpg,,좀비 바이러스 발생의 시발점이 된 고등학교. 이곳에 갇힌 학생들은 필사적으로 탈출구를 찾아야만 한다. 그렇지 않으면 감염되어 좀비가 될 뿐.,지금 우리 학교는,2022-01-27 15:00:00,
100857,,8.0,https://image.tmdb.org/t/p/original/iDHsm37QFqD1rD767NkzTUp8LnC.jpg,,,KBS2,b'\x00',https://image.tmdb.org/t/p/original/hUb32Sn5PPYXxoutmRAlsR4BCBE.jpg,,두 번의 생으로 얽힌 세 남녀의 운명과 부활을 그리는 환생 미스터리 멜로 드라마. 1980년대. ‘노란우산 연쇄살인사건’을 수사 중인 강력계 형사 형빈은 중고책방을 운영하는 연인 하은이 다음 피해자가 될까봐 노심초사한다. 그런 하은의 곁을 맴도는 수상한 남자 지철이 신경쓰이기 시작하는데...,본 어게인,2020-04-19 15:00:00,
101857,,8.0,https://image.tmdb.org/t/p/original/lQqSG7dtKSQYlc8tOaiOUGq325G.jpg,,,SBS,b'\x00',https://image.tmdb.org/t/p/original/m9uOUzd0qanRNN45BkORazjk7Nl.jpg,,스물아홉 경계에 선 클래식 음악 학도들의 아슬아슬 흔들리는 꿈과 사랑에 관한 이야기,브람스를 좋아하세요?,2020-08-30 15:00:00,
103752,,6.98,https://image.tmdb.org/t/p/original/qNVLLYtRKjhaMGDxlbmpWJFXZKf.jpg,,,Netflix,b'\x00',https://image.tmdb.org/t/p/original/dBTEyxerX02QTO6uFpeYKof3hqD.jpg,,위태롭기만 한 열여덟 청춘의 한가운데 선 소년 태주와 국의 케미장전 심쿵 브로맨스,너의 시선이 머무는 곳에,2020-05-21 15:00:00,
106600,,8.595,https://image.tmdb.org/t/p/original/hqFaSNICeh0Y3Hp0gtEIzDBmUVo.jpg,,,JTBC,b'\x00',https://image.tmdb.org/t/p/original/sm91twh5oLkRuBF1WHv7L6oiex3.jpg,,숲에서 여유롭게 휴식을 즐기는 방탄소년단의 모습을 담은 프로그램,인더숲 BTS편,2020-08-18 15:00:00,
106651,,7.5,https://image.tmdb.org/t/p/original/ikN8ABD9pXHuW4JFqTEHr3ae8rd.jpg,,,Netflix,b'\x00',https://image.tmdb.org/t/p/original/sgTu75c5PJsRHDMSna0ha8bhYWn.jpg,,"어느 날 기이한 존재로부터 지옥행을 선고받은 사람들. 지옥으로부터의 고지를 받은 자는 어김 없이 예정된 시간에 지옥의 사자들에게 끌려가는 일이 서울 한복판에서 모두가 지켜보는 가운데 일어난다. 충격과 두려움에 휩싸인 도시에 대혼란의 시대가 도래한 가운데, 신흥 종교 단체 새진리회의 의장 정진수는 이것이 진정으로 현실 세계에서 일어나고 있는 신의 집행임을 사람들에게 설파한다. 한편 일부는 새진리회에 맞서 싸우며 사건의 실체를 밝히려 한다.",지옥,2021-11-18 15:00:00,
107851,,7.37,https://image.tmdb.org/t/p/original/22DhrYUXwrdKbh54xAquSznypvP.jpg,,,Netflix,b'\x00',https://image.tmdb.org/t/p/original/8uki437wGs5bOCnFOBf3x6xnnqe.jpg,,"도시에 사는가? 그렇다면 도시괴담 하나 정도는 들어봤을 터. 평범한 일상에서 뭔가를 봤다는 이야기. 하지만 누구도 직접 본 적은 없다. 목격했다면 이미 이 세상 사람이 아닐지니. 볼 수 없는 것을 눈으로 확인할 기회, 지금뿐이다.",도시괴담,2020-08-19 15:00:00,
