program_id,age,average_rating,backdrop_path,broadcasting_day,broadcasting_episode,broadcasting_station,end_flag,poster_img,rating_cnt,summary,title,first_air_date,bookmark_cnt
77988,,9.0,https://image.tmdb.org/t/p/original/pVvdRuRhXDMCv1G6N0fZxNj9stW.jpg,,,tvN,b'\x00',https://image.tmdb.org/t/p/original/sNeWYRtQ1FVwPDgYdCXaYhGMkVM.jpg,,"정해진 예산 안에서 여행을 하며 스몰럭셔리 체험을 함께 해보는 여행 예능 프로그램. 나를 위한 작은 사치! 아낄 때는 아끼고, 쓸 때는 팍팍 쓰는 2030 청춘들의 새로운 소비 트렌드 ‘스몰 럭셔리(Small Luxury)’. 돈 없고 힘든 상황에서도 나만의 가치는 포기할 수 없는 여행자들을 위해! 짠내 나는 여행 후에 맛볼 수 있는 단내! 스몰럭셔리 체험을 위해! 설계자들이 직접 발로 뛰며 찾아낸, 여행 책에도 안 나오는 가성비甲 특급 정보들을 공유하고자 한다. 초저가 숙소부터, 착한 가격 맛 집, 무료 관광지, 가격 파괴 럭셔리 코스까지! 알뜰살뜰하게 사치하는 청춘들을 위한 가성비甲 럭셔리 여행, 짠내 투어가 시작된다.",짠내투어,2017-11-24 15:00:00,
78052,,6.7,https://image.tmdb.org/t/p/original/nvLgYtTY1mHZ7WEY0eWex8VK7nh.jpg,,,KBS2,b'\x00',https://image.tmdb.org/t/p/original/z44eFSH6IIWz2d9cxDM25nCfnHN.jpg,,"수제화 장인 효섭네 4남매에게 빌딩주 로또 엄마가 나타났다!! 유쾌한 웃음과 감동으로 신중년 부모세대와 자식 세대의 썸과 쌈, 사랑과 전쟁을 통해 가족의 의미를 그려낸 2060 전 세대 가족 로맨스",같이 살래요,2018-03-16 15:00:00,
78060,,7.4,https://image.tmdb.org/t/p/original/8q3R7yyCGfNjJmOxwnNvb0Hj30a.jpg,,,tvN,b'\x00',https://image.tmdb.org/t/p/original/5WU11nbHgmEsKy3lu2hT16amjbg.jpg,,"의사가 주인공이 아닌 병원 드라마. 물리치료사, 방사선사, 실습생들의 일상을 시(詩)와 함께 그려낸 감성 코믹극

돈과 빽은 없어도 감성만큼은 재벌급인 물리치료사 우보영!!

내가 키운 건 실력뿐... 감성은 엄마 뱃속에 두고 태어난 물리치료계의 알파고 예재욱!!

감성은 외장하드에 따로 보관한 듯 장난기로만 포맷된 물리치료과 실습생 신민호!

달라도 너무 다른 이들이 감성의 온도를 맞춰가며 펼치는 본격 심쿵 코믹이야기 위로 주옥같은 명시들이 어우러진다.

때로는 위트 넘치는 시처럼 당신을 웃게 할  때로는 가슴 찡한 시처럼 당신을 울게 할 공감백배 이야기

시를 잊은 그대의 메마른 감성을 촉촉하게 적셔줄 본격 코믹감성극이 당신을 찾아갑니다.",시를 잊은 그대에게,2018-03-25 15:00:00,
78295,,9.0,https://image.tmdb.org/t/p/original/riYsrkmzYy7Ki3hXpnVczz1mypo.jpg,,,MBC,b'\x00',https://image.tmdb.org/t/p/original/bCLdxexEuASy5mKjTRRi0MeKERh.jpg,,거액의 빚을 유산으로 상속받은 후 아버지의 명예를 위해 빚 갚기에 고군분투하는 부잣집 아들 '이광재'와 곁에서 적극적으로 그를 응원하는 씩씩한 여자 '김영하'의 이야기를 그린 드라마,부잣집 아들,2018-03-24 15:00:00,
78358,,9.0,https://image.tmdb.org/t/p/original/jaSZ1aHZLg32EEC4hNrWDAD9k9A.jpg,,,KBS Joy,b'\x00',https://image.tmdb.org/t/p/original/bjChv4zJmTFA0DMumOwIGZSr1oV.jpg,,레드벨벳이 매일 다른 방식의 여행을 체험해 여행을 레벨업 시키는 과정을 담은 리얼리티 프로그램,레벨업 프로젝트,2017-07-26 15:00:00,
78376,,0.0,https://image.tmdb.org/t/p/original/3jTQ36ExdnVlhB9AWLCdioPfzVS.jpg,,,SBS,b'\x00',https://image.tmdb.org/t/p/original/rFElUD9KdeRL9bu89wGG3Vm6Mud.jpg,,"한 지붕 아래, 두 마음 속 이야기를 시원하게 풀어보자! 각자의 입장에서 바라본 두 개의 세상은 어떤 모습일까? 누구보다 서로를 이해하고 싶은 사람들의 가장 포근한 리얼 스킨쉽! 털어놓고 공감하는 전 세대 공감 프로젝트! 다양한 분야의 커플들이 알콩달콩 살아가는 모습을 '남자'와 '여자' 입장에서 바라보고, 운명의 반쪽을 만난다는 것의 의미와 두 사람이 함께 사는 것의 가치를 살펴보는 프로그램",동상이몽,2015-04-24 15:00:00,
78385,,7.851,https://image.tmdb.org/t/p/original/50Rg7no3B9s3tPcDlilBZoXvO0U.jpg,,,JTBC,b'\x00',https://image.tmdb.org/t/p/original/tiYbWPfkJPbUOZpHbJXkwcKvRtO.jpg,,"2018년 3월 JTBC에서 방영을 시작한 드라마. 많이들 연애를 하지만 진짜 연애는 참 드물다. 영혼이 흔들릴 것 같은 연애, 나의 불치병보다 상대방의 감기가 더 아픈 연애, 우리는 진짜 해본 적이 있을까? 언제나 나만 생각하는 이기적인 내가 타인과 관계망에 대한 인식의 지평을 넓혀 진짜 교감을 할 수 있을까? 우리는 타인의 기쁨과 슬픔, 희열과 고통을, 그 질감을 가감 없이 그대로 느낄 수 있을까? 가능하다. 진짜 연애에 폭 빠져있는 그 순간에는. 끊임없는 관심으로 상대방을 들여다보고 그 인생의 모든 장면들을 낱낱이 기록하고 기억하는 일, 그것이 사랑이다.",밥 잘 사주는 예쁜 누나,2018-03-29 15:00:00,
78648,,9.8,https://image.tmdb.org/t/p/original/pNdUVPm6RwvG9Ycd2cuYpLbM7lk.jpg,,,tvN,b'\x00',https://image.tmdb.org/t/p/original/pnibkuL74C33GoKLTXAmF4nl3a6.jpg,,‘좋아요’ 폭발하는 SNS 핵 공감 핫 플레이스부터 오랜 전통이 살아 숨 쉬는 노포까지! 혀르가즘 자극하는 시장의 먹거리를 얻기 위한 MC군단의 자존심을 건 미션 수행! 고막 오픈! ‘도레미♪’ 흥겨운 음악을 듣고 가사를 맞히면 침샘 개장! ‘마켓’ 시장의 군침 가득 먹거리를 누릴 수 있다! 과연 MC 군단은 정신 혼미한 미션을 이겨내고 맛있는 음식을 먹을 수 있을까? 전국에 핫한 시장 속 핫한 음식을 걸고 펼쳐지는 MC 군단의 고군분투기! ‘도레미 마켓’!,놀라운 토요일,2018-04-06 15:00:00,
78742,,7.565,https://image.tmdb.org/t/p/original/AmAfghnxT74zebNIQClj53VUMsA.jpg,,,tvN,b'\x00',https://image.tmdb.org/t/p/original/fMs08AxfPj835zxkLHtXI0OrqA.jpg,,"수명 시계를 보는 능력을 지닌 여자 미카와 악연인지 인연인지 모를 운명에 엮인 남자 도하가 만나 사랑만이 구현할 수 있는 마법 같은 순간을 담아낸 운명구원 로맨스. 우연처럼 만나 운명처럼 사랑하게 된 도하와 미카. 이제 그 두 사람의 마음을 천천히 쫓아가 보고자 한다. 첫 만남의 설렘과 어긋난 오해에 싸르르 한 통증에 공감하고, 죽음을 받아들이고 살던 미카가 사랑하는 남자를 위해 살고 싶어지는 그 간절한 순간에 함께 하며, 오직 자신의 여자를 지키기 위해 목숨마저 내던지는 도하의 애틋한 사랑에 가슴 아파하면서, 운명을 뛰어넘는 그들의 눈부신 시간 속에, 오래도록 기억될 “특별한 사랑”이 그리운 당신에게…",멈추고 싶은 순간: 어바웃타임,2018-05-20 15:00:00,
78796,,7.6,https://image.tmdb.org/t/p/original/gDPFpRfyYxynniukcZXGGB6ELWX.jpg,,,tvN,b'\x00',https://image.tmdb.org/t/p/original/3htICE9fyI9zsgSIBUAZQGcxgzj.jpg,,"인권변호사인 엄마의 죽음을 눈앞에서 목도한 후, 엄마의 복수가 ‘생의 목적’이자 ‘절대 미션’이 되어버린 소년, 봉상필. 절치부심 18년을 준비해온 복수! 최고의 승소율을 자랑하는 변호사가 된 상필이 ‘기성(綺城)’으로 내려가면서 이 드라마는 시작된다. 여름 안개처럼 고요하고 정갈한 얼굴을 하고 있지만 그 어떤 쾌도로도 베지 못하는 비단의 도시. 판사, 검사, 언론, 정치인이 모두 결탁한 거대한 악의 블랙홀. 기성! 그 부패하고 철통같은 커넥션의 정점에 도사리고 있는 거악(巨惡) 차문숙을 상대로, 절대 불가능할 것만 같던 복수를 완성해 나가는 여정에서 상필은 자신이 진정으로 원한 것이 실은 복수를 꿈꾸지 않아도 되는 정의로운 세상이었음을 깨닫게 된다. 법 대신 주먹을 쓰던 무법(無法) 변호사가 자신의 인생을 걸고 절대 권력에 맞서 싸우며 진정한 무법(武法) 변호사로 성장해가는 거악소탕 법정활극.",무법 변호사,2018-05-11 15:00:00,
78797,,7.0,https://image.tmdb.org/t/p/original/stTddRelld2Pg50i9eS19xXJt3w.jpg,,,SBS,b'\x00',https://image.tmdb.org/t/p/original/kKt9aYn2sZTPkkDx1T7JKV3wHwK.jpg,,"달궈진 웍 안의 펄펄 끓는 기름보다 더 뜨거운 세 남녀의 진한 연애담으로 침샘까지 깊이 자극하는 로코믹 주방 활극이다. 경고 '절대 빈속으로 보지 말 것'

주 무대는 동네 중국집 ‘헝그리웍’.  남녀 주인공을 비롯해 이 드라마에는 미친 듯이 일하지 않는 등장인물은 없다.  펜대 굴리는 남자도 없고, 모니터 앞에서 자판 두드리는 여자도 사양한다.  회의는 욕설이 오가야 제대로요.  깨진 접시 너머로 불덩인지 쇳덩인지 웍이 날아다니고, 칼이 날아다닌다.  전쟁터 같은 이곳에서, 목숨 걸고 만든 짜장면은 그야말로 천하일미!  주방이라는 6평 직장 내에서 살아남고자 하는 인생들의 신개념 ‘주방 활극’이다!!",기름진 멜로,2018-05-06 15:00:00,
78798,,8.4,https://image.tmdb.org/t/p/original/56YHtJezhk6y7SczrYz6pmmf9oU.jpg,,,Netflix,b'\x00',https://image.tmdb.org/t/p/original/h0qCyNZ6vzyvAag7m6L6tA1dzLo.jpg,,"유재석과 허당 탐정들의 예측불허 추리 예능. 당신이 웃어넘긴 모든 순간이 단서가 된다! 추리는 초짜, 웃음만 고수인 7인의 허당 탐정단이 맞닥뜨리는 10개의 사건, 숨막히는 추적, 뜻밖의 손님들. 예측불허 사건 속, 탐정단은 과연 최후의 배후를 밝혀낼 수 있을 것인가?",범인은 바로 너!,2018-05-03 15:00:00,
78869,,7.895,https://image.tmdb.org/t/p/original/xVEy0lyncaXMyYooGXcspVvHW3p.jpg,,,JTBC,b'\x00',https://image.tmdb.org/t/p/original/jyHHFaV0B22L2xKNJ0j1F2RZuH7.jpg,,"청결에 죽고 사는 청소업체 CEO 남자. 청결이 먹는 건지 입는 건지 관심 없는 취준생 여자. 물과 기름 같은 둘이 만나 옥신각신하더니 어라, 달달한 기운이? 남자가 결벽증을 버리려나, 여자가 더러움을 벗으려나? 궁금하다, 궁금해!",일단 뜨겁게 청소하라,2018-11-25 15:00:00,
79069,,7.0,https://image.tmdb.org/t/p/original/4vWtb5Mta7QB9Q5H0WcwclyeDzI.jpg,,,KBS1,b'\x00',https://image.tmdb.org/t/p/original/2F2RhfiIOFFDIOcmYx0eLqUY1gE.jpg,,흙수저 무스펙 주인공이 그려내는 7전8기 인생 리셋 스토리와 주변 가족들의 살맛나는 이야기를 그린 드라마,내일도 맑음,2018-05-06 15:00:00,
79070,,8.1,https://image.tmdb.org/t/p/original/d7LsIZcoyr8C7llUaB45QCxHPXx.jpg,,,MBC,b'\x00',https://image.tmdb.org/t/p/original/w3vY4iqn1Go7zsoRCKqRfGXTPDq.jpg,,"모든 접촉은 흔적을 남긴다! 범죄에도, 그리고 인생에도. 그리하여 완전 범죄란 없다. 그러나 그들의 공조는 완전하다. 피해자를 부검하는 괴짜 법의학자와 가해자를 수사하는 초짜 검사의 아주 특별한 공조가 펼쳐진다. 완벽주의에 괴팍한 성격을 가진 법의학자인 백범과 포토메모리 능력을 가졌지만 허당미 가득한 검사 은솔의 공조 수사를 다룬 드라마.",검법남녀,2018-05-13 15:00:00,
79076,,6.5,https://image.tmdb.org/t/p/original/ayy7YZVdHuzXpjYPH8EL3ozHhM2.jpg,,,SBS,b'\x00',https://image.tmdb.org/t/p/original/5dT7P6Ru3UBCanmyhP6FeMLTQqK.jpg,,사랑을 거부하는 비연애주의자 '훈남'과 사랑을 꿈꾸지만 팍팍한 현실에 연애포기자가 된 '정음'이 연애불능 회원들의 솔로 탈출을 도와주다가 사랑에 빠져버린 코믹 로맨스,훈남정음,2018-05-22 15:00:00,
79238,,6.923,https://image.tmdb.org/t/p/original/uQYUe1EnEV5ATRWHQ6F0UihDcuO.jpg,,,MBC,b'\x00',https://image.tmdb.org/t/p/original/63zg7dGRGdRgctJcl4jbtmIWcQ7.jpg,,한 살인사건으로 인해 엇갈린 삶을 살게 된 남녀의 기구한 운명을 그린 드라마,이리와 안아줘,2018-05-15 15:00:00,
79342,,8.3,https://image.tmdb.org/t/p/original/AoA8SKDo03ru1gohrqy6qRvtcOk.jpg,,,JTBC,b'\x00',https://image.tmdb.org/t/p/original/o2l8uEuiYhiL6jro7N5cMIzne0E.jpg,,"강한 자에게 강하고 약한 자에게 약한 법원을 꿈꾸는 이상주의 열혈 초임 판사, 섣부른 선의보다 원리원칙이 최우선인 초엘리트 판사, 세상의 무게를 아는 현실주의 부장 판사, 달라도 너무 다른 세 명의 재판부가 펼치는 生 리얼 초밀착 법정 드라마",미스 함무라비,2018-05-20 15:00:00,
79434,,8.396,https://image.tmdb.org/t/p/original/kKlzA0owtx63wxpiYxgzSXrx6yz.jpg,,,tvN,b'\x00',https://image.tmdb.org/t/p/original/3hd6yqp59ozCt2DRlFtj1tD9cHH.jpg,,"재력, 얼굴, 수완까지 모든 것을 다 갖췄지만 자기애로 똘똘 뭉친 나르시시스트 부회장과 그를 완벽하게 보좌해온 비서의 퇴사밀당 로맨스. 잘생긴 얼굴, 완벽한 비율, 영특한 머리, 탁월한 경영 능력까지! 태어나서 지금까지, 늘 모든 분야에서 독보적인 1위였다. 스스로를 너무 사랑한 나머지 연애 한 번 안 하고, 스스로 너무 잘난 나머지 주변 사람들의 부족함을 견디지 못하는 그가 곁을 허락하는 유일한 사람이 있었으니 오래된 부부 같은 호흡을 자랑하는 비서, ‘김미소’다. 그런데 그런 김비서가 어느 날 갑자기 퇴사를 선언한다. ""대체 왜? 나를 보필할 수 있는 초특급 영예를 박차고 나가겠다고...?"" 대체... 김비서가 왜 그럴까?",김비서가 왜 그럴까,2018-06-05 15:00:00,
79449,,9.0,https://image.tmdb.org/t/p/original/mmuouwdVojGmeC9TLsgBrxCWAeE.jpg,,,JTBC,b'\x00',https://image.tmdb.org/t/p/original/mVTXZH80hnXVgFmeRQQGtE4m5hZ.jpg,,시사보도 신뢰도 1위에 뉴스룸이 있다면 대한민국 아이돌들에겐 아이돌룸이 있다! 예능 왕국 JTBC에서 탄생하는 독보적 아이돌 전문 예능 프로그램!! 아이돌이 원하는 예능이란... 부담 없이 자신의 모든 것을 보여줄 수 있는 방송. 아이돌 팬들이 원하는 예능이란... 논란의 걱정 없이 편하게 웃으며 시청할 수 있는 방송. 화제성 100% 논란 0%. 아이돌과 아이돌 팬들이 모두 인정한 아이돌계의 신뢰도 1위의 MC 정형돈과 데프콘과 방대한 아이돌 지식으로 무장한 제작진이 뭉쳐 그들이 원하는 꿈의 방송을 실현시킨다. 전 국민에게 인정받는 신뢰도 NO.1 뉴스 JTBC 뉴스룸을 잇는 아이돌 예능계의 신뢰도 NO.1. 아이돌 전문 버라이어티쇼 아이돌룸,아이돌룸,2018-05-11 15:00:00,
79667,,9.0,https://image.tmdb.org/t/p/original/i6hSbKaulhfIjoYq8zQjG0dIUsZ.jpg,,,SBS,b'\x00',https://image.tmdb.org/t/p/original/rN9O5kZ9ChzRpYXlCFfXThPFiMd.jpg,,"모든 식당은 나름의 걱정과 문제를 갖고 있는 법! 천 개의 가게가 있다면, 천 개의 상황이 있다. 요식업 대선배 백종원 대표가 각 식당의 문제 케이스를 찾아내고 해결 방안을 제시 식당을 시작하는 사람들에게 ‘교본’이 되어줄 프로그램",백종원의 골목식당,2018-01-04 15:00:00,
80281,,7.4,https://image.tmdb.org/t/p/original/bMkG3Ss653TF7u0xqiNWQ4sFxuR.jpg,,,KBS1,b'\x00',https://image.tmdb.org/t/p/original/4KK1IEN0U6BMTwMSeQn5mdUbg4J.jpg,,"인간들이 사는 세상에서 끊임없이 무엇인가 떨어진다. 씹다 버린 껌. 먹다 버린 아이스크림, 동전, 반지 등등. 작고 귀여운 애벌레 레드와 옐로우는 이 모든 것이 신기하다. 때론 이 물건들로 인해 곤란해지기도 하고 행복해지기도 하며 떨어진 물건을 차지하기 위해 티격태격 싸우기도 한다. 워낙 작은 존재라 빗방울, 추위 등으로 인해 엄청난 위기 상황에 던져지기도 하는데…",라바,2011-03-25 15:00:00,
80736,,0.0,https://image.tmdb.org/t/p/original/o82rmThq339zBdO8Bd3gUyBic0o.jpg,,,MBC,b'\x00',https://image.tmdb.org/t/p/original/oRoGuuYiyQmxc1fU5oV5dPKlnAz.jpg,,"""당신의 인생에 참견해드립니다!"" 매니저들의 거침없는 제보로 공개되는 스타들의 리얼 일상! 그리고 시작되는 다양한 '참견 고수'들의 시시콜콜한 참견!",전지적 참견 시점,2018-03-09 15:00:00,
80737,,7.509,https://image.tmdb.org/t/p/original/eNK7aolIJ75W7tNeh5I0An14rtg.jpg,,,JTBC,b'\x00',https://image.tmdb.org/t/p/original/u3ECyrETokQpgzrL5xmG6G49d7U.jpg,,"항상 외모로 놀림받았다. 그리고 스무 살, 새 삶을 위해 수술대 위에 올랐다. 놀랄 만큼 예뻐졌지만 얻은 건 성형 괴물, ‘강남미인’이란 아이디. 게다가 과거를 아는 동창생이 같은 과라니. 꿈꿨던 대학 생활, 진짜 꿈으로만 끝? 새 얼굴이면 새 삶이 펼쳐질 줄 알았건만! 못생겼다는 놀림에서 해방되려 성형 수술을 했지만, 이젠 자연 미인이 아니라 조롱받는다. 난 결코 평범해질 수 없는 운명일까. 스무 살 청춘의 설상가상 외모 트라우마 탈출기, 지금 시작됩니다!",내 아이디는 강남미인,2018-07-26 15:00:00,
80741,,8.1,https://image.tmdb.org/t/p/original/aGdNgRYQF4EZ2GDSIagkvTkGSKu.jpg,,,tvN,b'\x00',https://image.tmdb.org/t/p/original/hV9bGG2scBvCvDOfa6hsBEchuk0.jpg,,"2018년 8월 tvN에서 방영을 시작한 드라마. 남과 여, 둘은 서로를 향해 페로몬을 난사하고 이내 사랑에 빠진다. 그들은 결혼을 하고 아이를 낳는다. 남자는 샐러리맨의 정글에서 살아남느라 여력이 없고, 여자는 워킹맘, 육아맘 생활에 망가져간다. 남자는 이 여자가 바라만 봐도 가슴 터질 듯 설레던 그때 그 여자가 맞나 싶고, 여자는 이 결혼생활이 지리멸렬하다. 그만큼 결혼이라는 현실은 남녀 모두에게 책임과 희생을 강요하며, 굴레를 씌우고 핍박을 가한다. 이쯤 되면 둘은 이런 생각이 든다. 우리... 잘못된 인연을 택한 걸까?",아는 와이프,2018-07-31 15:00:00,
80919,,8.3,https://image.tmdb.org/t/p/original/yenAWht4P9vtwKVEoUOskKoc4d2.jpg,,,SBS,b'\x00',https://image.tmdb.org/t/p/original/2pBao6zS5WQYAmAE6BuATeIgna5.jpg,,열일곱에 코마에 빠져 서른이 돼 깨어난 '멘탈 피지컬 부조화女'와 세상과 단절하고 살아온 '차단男'. 이들의 서른이지만 열일곱같은 애틋하면서도 코믹한 로코,서른이지만 열일곱입니다,2018-07-22 15:00:00,
80959,,6.5,https://image.tmdb.org/t/p/original/g3GEKOwtGBjhPKBvRsGVh9uDJ8c.jpg,,,SBS,b'\x00',https://image.tmdb.org/t/p/original/9TP0UhlCz8EpafyHQzpq6Bz9ma5.jpg,,"타인의 삶을 탐낸 자들의 유쾌한 최후! 비상한 두뇌, 훤칠한 외모. 모든 유전자를 똑같이 나눠 가졌으나 전혀 다른 삶을 사는 형제가 있다. 수호 & 강호. 양형 기준을 벗어난 판결이 단 한 번도 없는 ‘컴퓨터 판사’ 한수호가 사라졌다. 은근슬쩍 그 자리를 차지한 동생 한강호, 전과 5범을 거치며 쌓은 ‘실전법률’을 바탕으로 전례 없는 통 큰 판결을 시작한다.  更生 (갱생). 교도소에서 아침저녁으로 외치던 구호 갱생! 말 그대로 인생이 다시 시작됐다. 냉대 받던 전과자에서 친애하는 판사님으로, 인간 쓰레기에서 결혼 상대 1위로, 집안의 망나니에서 가문의 보배로. 그렇다고 예전의 내가 지금의 나로 완전히 바뀔 수 있을까. 어느 날 갑자기 내가 ‘무엇’이 된다면 모든 욕망이 채워질까? 그 욕망이 다 채워진다면 더 이상 결핍은 존재하지 않을까? 이 이야기는 타인의 삶을 탐낸 사람들이 자신의 삶을 찾아가는 과정이다.",친애하는 판사님께,2018-07-24 15:00:00,
81135,,8.5,https://image.tmdb.org/t/p/original/4xt9a3s0grrgsV8kn9x6yZ5NH2l.jpg,,,KBS2,b'\x00',https://image.tmdb.org/t/p/original/wO0HOmuV3IFvlm6OaiePpvDWX4h.jpg,,"지금 이 나라에는 대체 무슨 일들이 벌어지고 있는 걸까?  최근 들어 하나씩 드러나는 우리 사회의 민낯들은 너무도 참혹하고 부끄럽다.

우리는 과연 새로운 세상을 만들 수 있을까?  우리는 어디까지 꿈꿀 수 있을까.  지금의 혼돈은 새 시대를 열기위한 아픈 과정이고 성장을 위한 시간들이라고 믿는다.  개인의 삶도 그와 다르지 않다.  제대로 잘 살기란 얼마나 어려운 일인가.  이 드라마는 무너진 가정을 다시 세우는 이야기이다.  주인공들은 서로를 지극히 사랑함에도 어쩔 수 없이 이별하고, 지은 죄도 없이 나락으로 떨어진다.  남의 일이 아니다. 우리도 삶의 갈피마다 흔들리고 무너지고 절망한다.  그럼에도 불구하고 삶은 계속 되어야한다.  주인공들이 시련을 이겨내고 다시 일어서는 모습을 보며, 작은 위로라도 받길 바란다.  어떻게 살아야할까? 어디에 희망을 걸고 버텨야하나?  답은 역시, 사람이다.  그 어떤 경우에도 사람을 사랑하는 일만은 끝까지 포기하지 말자!",끝까지 사랑,2018-07-22 15:00:00,
81211,,8.225,https://image.tmdb.org/t/p/original/uzgvxmEGIwgqyaEbc6OXy0YbSTN.jpg,,,MBC,b'\x00',https://image.tmdb.org/t/p/original/g74tHdgK6YlRu7Uf7AL7xmHdjl.jpg,,사라진 전설의 블랙 요원과 운명처럼 첩보 전쟁에 뛰어든 앞집 여자의 수상쩍은 환상의 첩보 콜라보,내 뒤에 테리우스,2018-09-26 15:00:00,
81332,,7.6,https://image.tmdb.org/t/p/original/cd0K3qFGsbetwFOMSkMhBKkGF1V.jpg,,,KBS2,b'\x00',https://image.tmdb.org/t/p/original/iJlSSm7gDWNFwXhxokbIa8O53yg.jpg,,운명을 공유하는 한 남녀가 톱스타와 드라마 작가로 만나면서 일어나는 기이한 일들을 그린 호러 로맨틱 코미디,러블리 호러블리,2018-08-12 15:00:00,
81745,,6.3,https://image.tmdb.org/t/p/original/45CtSWBbMtGQqb0cIk9xBmkjS5l.jpg,,,MBC,b'\x00',https://image.tmdb.org/t/p/original/dtNi8XDyc8Y7p4vvNyiP1MCfYMe.jpg,,"대한민국 유수의 화장품 기업의 상속녀와 그의 인생을 대신 살아야만 했던 또 다른 여자에게 주어진 운명, 그리고 이를 둘러싼 욕망과 비밀을 그렸다고 하는 막장 드라마",숨바꼭질,2018-08-24 15:00:00,
81821,,8.263,https://image.tmdb.org/t/p/original/qK4wHkIaq2qnJs1iOUJES8wDY5X.jpg,,,tvN,b'\x00',https://image.tmdb.org/t/p/original/tUoXjOSb7j269xVF4xeZPqoZl7n.jpg,,"2018년 9월 tvN에서 방영을 시작한 드라마. 완전무결 왕세자에서 졸지에 무쓸모남으로 전락한 원득(도경수)과 조선 최고령 원녀 홍심(남지현)의 전대미문 100일간의 로맨스를 그린다. 금수저 끝판왕이자 완전무결의 대명사였던 왕세자 이율은 백성들 사이에 섞이자 무능하기 짝이 없는 사내가 된다. 백성들이 다 아는 걸 그는 모른고, 그래서 온갖 핍박을 당한다. 천것이던 노처녀 홍심은 갑이 되고, 극존이던 세자 율은 을이 된다.",백일의 낭군님,2018-09-09 15:00:00,
81822,,8.2,https://image.tmdb.org/t/p/original/iTaJO0kba2A1tee8LY3wyS0N3pw.jpg,,,OCN,b'\x00',https://image.tmdb.org/t/p/original/8oCU7t7husLeAN2YxgBpQgIma7Q.jpg,,"2018년 9월 OCN에서 방영을 시작한 미스터리 드라마. 동해의 작은 마을에 전해 오는 전설이 있다. 동쪽 바다 깊은 곳에서 와서 사람에게 들어온다는 큰 귀신, 손. 20년 전 작은 마을에서 잔인한 살인 사건이 발생한다. 그리고 20년 후 발생하는 일련의 기괴한 살인 사건들. 말로 설명되지 않는 기이한 힘에 의해 벌어진 범죄. 인간의 일그러진 마음에 깃든 손, 그 손에 씌인 사람들이 저지르는 잔인한 살인사건들. 영매, 사제, 그리고 형사가 각기 다른 이유로 손을 찾기 시작한다. 이들이 쫓는 손의 정체는 무엇일까?",손: The Guest,2018-09-11 15:00:00,
81978,,7.8,https://image.tmdb.org/t/p/original/dg7atessB8fKewGH9n8hSVz93VJ.jpg,,,tvN,b'\x00',https://image.tmdb.org/t/p/original/tdGJ2swRbtHT2O3fUXauKVSXNp9.jpg,,유재석X조세호가 일상 속 숨어있는 퀴즈왕을 찾아다니는 유쾌한 길거리 퀴즈쇼! 너는 풀어라! 나는 쏠테니! 큰 자기 유재석과 아기자기 조세호의 자기들 마음대로 떠나는 사람 여행!,유 퀴즈 온 더 블럭,2018-08-28 15:00:00,
82063,,7.5,https://image.tmdb.org/t/p/original/5icoA1Tnw1VQ6tYaN8HRsHjb5Jc.jpg,,,KBS2,b'\x00',https://image.tmdb.org/t/p/original/eYFlwGID7nPkV0Rl4ZX26wJvnYB.jpg,,28년 만에 나타난 친부로 인해 인생이 꼬여버린 한 여자와 정체를 숨겨야만 했던 그녀의 아버지가 ‘세상 단 하나뿐인 내편’을 만나며 삶의 희망을 되찾아가는 과정을 그린 드라마,하나뿐인 내편,2018-09-14 15:00:00,
